{
  "$schema": "https://json-schema.org/draft/2020-12/schema",
  "$id": "https://rwaimport.xyz/schemas/underlying.schema.json",
  "title": "RWAImport underlying instrument",
  "type": "object",
  "additionalProperties": false,
  "required": ["schemaVersion", "id", "name", "ticker", "type", "status", "dataAvailability", "sourceAssetIds"],
  "properties": {
    "schemaVersion": { "const": 1 },
    "id": { "$ref": "#/$defs/id" },
    "name": { "type": "string", "minLength": 1, "maxLength": 300 },
    "ticker": { "type": "string", "minLength": 1, "maxLength": 32 },
    "type": {
      "enum": ["equity", "exchange-traded-fund", "treasury", "money-market-fund", "bond", "commodity", "private-credit", "real-estate", "cash", "other"]
    },
    "identifiers": {
      "type": "array",
      "uniqueItems": true,
      "items": {
        "type": "object",
        "additionalProperties": false,
        "required": ["scheme", "value"],
        "properties": {
          "scheme": { "enum": ["isin", "cusip", "figi", "lei", "cik", "issuer-id"] },
          "value": { "type": "string", "minLength": 1, "maxLength": 100 }
        }
      }
    },
    "exchange": { "type": "string", "minLength": 1, "maxLength": 100 },
    "jurisdiction": { "type": "string", "pattern": "^[A-Z]{2}$" },
    "currency": { "type": "string", "pattern": "^[A-Z]{3}$" },
    "dataAvailability": {
      "type": "object",
      "additionalProperties": false,
      "required": ["identifiers", "exchange", "jurisdiction"],
      "properties": {
        "identifiers": { "$ref": "#/$defs/availability" },
        "exchange": { "$ref": "#/$defs/availability" },
        "jurisdiction": { "$ref": "#/$defs/availability" }
      }
    },
    "sources": {
      "type": "array",
      "minItems": 1,
      "items": {
        "type": "object",
        "additionalProperties": false,
        "required": ["id", "title", "url", "publisher", "retrievedAt"],
        "properties": {
          "id": { "$ref": "#/$defs/id" },
          "title": { "type": "string", "minLength": 1, "maxLength": 300 },
          "url": { "type": "string", "format": "uri", "pattern": "^https://" },
          "publisher": { "type": "string", "minLength": 1, "maxLength": 200 },
          "retrievedAt": { "type": "string", "format": "date-time" }
        }
      }
    },
    "claims": {
      "type": "array",
      "items": {
        "type": "object",
        "additionalProperties": false,
        "required": ["field", "sourceIds", "reviewStatus"],
        "properties": {
          "field": { "enum": ["identifiers", "exchange", "jurisdiction"] },
          "sourceIds": { "type": "array", "minItems": 1, "uniqueItems": true, "items": { "$ref": "#/$defs/id" } },
          "reviewStatus": { "enum": ["verified", "needs-review", "disputed"] }
        }
      }
    },
    "status": { "enum": ["active", "inactive"] },
    "sourceAssetIds": {
      "type": "array",
      "minItems": 1,
      "uniqueItems": true,
      "items": { "$ref": "#/$defs/id" }
    }
  },
  "$defs": {
    "id": { "type": "string", "pattern": "^[a-z0-9]+(?:-[a-z0-9]+)*$", "maxLength": 100 },
    "availability": { "enum": ["known", "unknown", "not-applicable"] }
  }
}
