{
  "schemaVersion": 1,
  "id": "equity-meta",
  "name": "Meta Platforms",
  "ticker": "META",
  "type": "equity",
  "currency": "USD",
  "status": "active",
  "sourceAssetIds": [
    "metaon",
    "robinhood-meta"
  ],
  "identifiers": [
    {
      "scheme": "isin",
      "value": "US30303M1027"
    },
    {
      "scheme": "cik",
      "value": "0001326801"
    }
  ],
  "dataAvailability": {
    "identifiers": "known",
    "exchange": "known",
    "jurisdiction": "known"
  },
  "exchange": "Nasdaq",
  "jurisdiction": "US",
  "sources": [
    {
      "id": "sec-company-tickers-exchange",
      "title": "SEC company ticker and exchange catalog",
      "url": "https://www.sec.gov/files/company_tickers_exchange.json",
      "publisher": "U.S. Securities and Exchange Commission",
      "retrievedAt": "2026-10-01T12:21:05.324Z"
    }
  ],
  "claims": [
    {
      "field": "identifiers",
      "sourceIds": [
        "sec-company-tickers-exchange"
      ],
      "reviewStatus": "verified"
    },
    {
      "field": "exchange",
      "sourceIds": [
        "sec-company-tickers-exchange"
      ],
      "reviewStatus": "verified"
    },
    {
      "field": "jurisdiction",
      "sourceIds": [
        "sec-company-tickers-exchange"
      ],
      "reviewStatus": "verified"
    }
  ]
}
