{
  "schemaVersion": 1,
  "id": "equity-acls",
  "name": "Axcelis Technologies",
  "ticker": "ACLS",
  "type": "equity",
  "currency": "USD",
  "status": "active",
  "sourceAssetIds": [
    "aclson"
  ],
  "dataAvailability": {
    "identifiers": "unknown",
    "exchange": "unknown",
    "jurisdiction": "unknown"
  }
}
