{
  "schemaVersion": 1,
  "id": "equity-ccj",
  "name": "Cameco",
  "ticker": "CCJ",
  "type": "equity",
  "currency": "USD",
  "status": "active",
  "sourceAssetIds": [
    "ccjon"
  ],
  "dataAvailability": {
    "identifiers": "unknown",
    "exchange": "unknown",
    "jurisdiction": "unknown"
  }
}
