{
  "schemaVersion": 1,
  "id": "equity-sap",
  "name": "SAP",
  "ticker": "SAP",
  "type": "equity",
  "currency": "USD",
  "status": "active",
  "sourceAssetIds": [
    "sapon"
  ],
  "dataAvailability": {
    "identifiers": "unknown",
    "exchange": "unknown",
    "jurisdiction": "unknown"
  }
}
