{
  "schemaVersion": 1,
  "id": "equity-eqix",
  "name": "Equinix",
  "ticker": "EQIX",
  "type": "equity",
  "currency": "USD",
  "status": "active",
  "sourceAssetIds": [
    "eqixon"
  ],
  "dataAvailability": {
    "identifiers": "unknown",
    "exchange": "unknown",
    "jurisdiction": "unknown"
  }
}
