{
  "schemaVersion": 1,
  "id": "equity-pr",
  "name": "Permian Resources",
  "ticker": "PR",
  "type": "equity",
  "identifiers": [
    {
      "scheme": "isin",
      "value": "US71424F1057"
    }
  ],
  "currency": "USD",
  "status": "active",
  "sourceAssetIds": [
    "robinhood-pr"
  ],
  "dataAvailability": {
    "identifiers": "known",
    "exchange": "unknown",
    "jurisdiction": "unknown"
  }
}
