{
  "schemaVersion": 1,
  "id": "fund-wtgxx",
  "name": "WisdomTree Treasury Money Market Digital Fund",
  "ticker": "WTGXX",
  "type": "money-market-fund",
  "currency": "USD",
  "status": "active",
  "sourceAssetIds": [
    "wtgxx"
  ],
  "dataAvailability": {
    "identifiers": "unknown",
    "exchange": "unknown",
    "jurisdiction": "unknown"
  }
}
