{
  "schemaVersion": 1,
  "id": "equity-mod",
  "name": "Modine",
  "ticker": "MOD",
  "type": "equity",
  "identifiers": [
    {
      "scheme": "isin",
      "value": "US6078281002"
    }
  ],
  "currency": "USD",
  "status": "active",
  "sourceAssetIds": [
    "robinhood-mod"
  ],
  "dataAvailability": {
    "identifiers": "known",
    "exchange": "unknown",
    "jurisdiction": "unknown"
  }
}
