{
  "schemaVersion": 1,
  "id": "equity-exod",
  "name": "Exodus Movement",
  "ticker": "EXOD",
  "type": "equity",
  "currency": "USD",
  "status": "active",
  "sourceAssetIds": [
    "exodon"
  ],
  "dataAvailability": {
    "identifiers": "unknown",
    "exchange": "unknown",
    "jurisdiction": "unknown"
  }
}
