{
  "schemaVersion": 1,
  "id": "equity-aloy",
  "name": "REalloys",
  "ticker": "ALOY",
  "type": "equity",
  "currency": "USD",
  "status": "active",
  "sourceAssetIds": [
    "aloyon"
  ],
  "dataAvailability": {
    "identifiers": "unknown",
    "exchange": "unknown",
    "jurisdiction": "unknown"
  }
}
