{
  "schemaVersion": 1,
  "id": "equity-enb",
  "name": "Enbridge",
  "ticker": "ENB",
  "type": "equity",
  "currency": "USD",
  "status": "active",
  "sourceAssetIds": [
    "enbon"
  ],
  "dataAvailability": {
    "identifiers": "unknown",
    "exchange": "unknown",
    "jurisdiction": "unknown"
  }
}
