{
  "schemaVersion": 1,
  "id": "equity-camt",
  "name": "Camtek",
  "ticker": "CAMT",
  "type": "equity",
  "currency": "USD",
  "status": "active",
  "sourceAssetIds": [
    "camton"
  ],
  "dataAvailability": {
    "identifiers": "unknown",
    "exchange": "unknown",
    "jurisdiction": "unknown"
  }
}
