{
  "schemaVersion": 1,
  "id": "equity-arqq",
  "name": "Arqit Quantum",
  "ticker": "ARQQ",
  "type": "equity",
  "currency": "USD",
  "status": "active",
  "sourceAssetIds": [
    "arqqon"
  ],
  "dataAvailability": {
    "identifiers": "unknown",
    "exchange": "unknown",
    "jurisdiction": "unknown"
  }
}
