{
  "schemaVersion": 1,
  "id": "fund-bkch",
  "name": "Global X Blockchain ETF",
  "ticker": "BKCH",
  "type": "exchange-traded-fund",
  "currency": "USD",
  "status": "active",
  "sourceAssetIds": [
    "bkchon"
  ],
  "dataAvailability": {
    "identifiers": "unknown",
    "exchange": "unknown",
    "jurisdiction": "unknown"
  }
}
