{
  "schemaVersion": 1,
  "id": "fund-spmo",
  "name": "Invesco S&P 500 Momentum ETF",
  "ticker": "SPMO",
  "type": "exchange-traded-fund",
  "identifiers": [
    {
      "scheme": "isin",
      "value": "US46138E3392"
    }
  ],
  "currency": "USD",
  "status": "active",
  "sourceAssetIds": [
    "robinhood-spmo"
  ],
  "dataAvailability": {
    "identifiers": "known",
    "exchange": "unknown",
    "jurisdiction": "unknown"
  }
}
